{
  "email_type": "first_touch",
  "customer_name": "Anna",
  "company_name": "GreenHarvest Foods",
  "product_or_offer": "frozen mixed vegetables",
  "goal": "introduce our offer with a relevant angle: Open by referencing the public LinkedIn/website context cautiously, then connect the note to private-label frozen vegetable supply support.",
  "country_or_market": "Poland",
  "customer_profile_summary": "Company appears focused on imported frozen vegetables and private-label frozen food programs for the Poland market.",
  "previous_contact_context": "",
  "tone": "professional,conservative",
  "sender_name": "Leo",
  "sender_company": "Ningbo FreshGrow Foods",
  "signature": "",
  "constraints": "Use only public, confirmed information. Avoid hard claims about demand, pricing, or purchasing intent.",
  "source_context": {
    "risk_rating": "Medium",
    "entity_confidence": "medium",
    "evidence_sufficiency": "limited",
    "intel_recommended_next_action": "ready_for_email_draft",
    "ambiguity_notes": [],
    "unconfirmed_fact_list": [
      "当前仍需人工确认采购角色与实际产品匹配度。",
      "公开证据仍不足以支持强个性化判断，进入开发信前需人工确认。"
    ],
    "evidence_titles": [
      "GreenHarvest Foods contact page",
      "GreenHarvest Foods LinkedIn company page"
    ],
    "recent_signals": [
      "GreenHarvest Foods LinkedIn company page | expansion | unknown | low"
    ],
    "market_signals": [
      "Poland / EU frozen food compliance context | compliance | unknown | low"
    ],
    "recommended_opening_signal_en": "GreenHarvest Foods LinkedIn company page",
    "recommended_sales_angle_en": "Open by referencing the public LinkedIn/website context cautiously, then connect the note to private-label frozen vegetable supply support."
  }
}
