{
  "email_type": "follow_up",
  "customer_name": "Nadia",
  "company_name": "Nordic Home Textile AB",
  "product_or_offer": "washed linen table textile collections",
  "goal": "follow up on our catalog sharing and ask whether selected fabric swatches would be useful for review",
  "country_or_market": "Sweden",
  "customer_profile_summary": "Brand appears focused on Scandinavian home textile collections with natural material positioning.",
  "previous_contact_context": "We shared our digital catalog three days ago and mentioned low-MOQ support for seasonal collections.",
  "tone": "professional,warm",
  "sender_name": "Mia",
  "sender_company": "Hangzhou LinenCraft Textiles",
  "signature": "Best regards,\nMia\nHangzhou LinenCraft Textiles",
  "constraints": "Keep the follow-up soft and design-oriented."
}
